name,locationX,locationY,description,amenities,website,locationAddress
The Southern Ridges,103.8048341,1.279876996,"Go on a hike in the great outdoors and enjoy the serenity on offer at the Southern Ridges. ... Henderson Waves, a structure not to be missed, connects Mount Faber Park to Telok Blangah Hill Park.",<Null>,http://www.nparks.gov.sg/cms/index.php?option=com_visitorsguide&task=parks&id=62&Itemid=73,"33 Hyderabad Road, Off Alexandra Road"
Tiong Bahru Park,103.8243399,1.287589986,,Drinking fountain   Pond pavilion   Foot reflexology footpath   Fitness corner or stations and fitness equipment or exercise station,http://www.nparks.gov.sg/cms/index.php?option=com_visitorsguide&task=parks&id=37&Itemid=73,"Bounded by Henderson Rd, Tiong Bahru Road and Lower Delta Road"
Toa Payoh Town Park,103.8484399,1.330619992,"Developed in the seventies, Toa Payoh Town Park was a popular venue for wedding couples, especially those who wished to capture the style and fashion of the seventies. With a large pavilion, landscaped pond, rustic-looking gazebos and amenities such as open-concept restrooms, the park still retains its charm and beauty, and is a great place for families to gather for recreation.",Foot reflexology footpath   Food and beverage area or restaurant or cafe   Benches   Jogging path or running track   Pond   Pavilions with or without stage   Shelters   Toilets,http://www.nparks.gov.sg/cms/index.php?option=com_visitorsguide&task=parks&id=38&Itemid=73,Junction of Toa Payoh Lor 2 and Toa Payoh Lor 6
War Memorial Park,103.8548099,1.292819943,War Memorial Park sits on a piece of land that former Prime Minister Lee Kuan Yew set aside for the building of a memorial in remembrance of all civilian victims who had perished in World War II.,<Null>,http://www.nparks.gov.sg/cms/index.php?option=com_visitorsguide&task=parks&id=40&Itemid=73,"Bounded by Nicoll Highway, Stamford Road, Beach Road and Bras Basah Road"
West Coast Park,103.7643394,1.294702574,"Themed as the ""Play Centre in the West"", West Coast Park is a large regional park located in the southwest of Singapore. A linear park comprising 50 hectares of park land, the park runs parallel to West Coast Highway.",Benches   Barbecue pits   Bicycle obstacle course   Children's play equipment   Cycling track   Dog run corner   Exercise garden including a chess garden foot reflexology facilities and bird cage trellis   Food and beverage area or restaurant or cafe   Fitness corneror stations and fitness equipment or exercise station   Grand lawn Jogging path or running track   Marsh garden   Pond   Playground   Pergola Promenade   Restroom or Toilets with or without shower facilities   Shelters   Sand play area   Taichi corner   Health and fitness activities   Children's playground   Event lawn   Toilets,http://www.nparks.gov.sg/cms/index.php?option=com_visitorsguide&task=parks&id=41&Itemid=73,Parallel to West Coast Highway
Woodlands Town Garden,103.77019,1.437809918,,Amphitheatre    Pond   Playground   Restroom or Toilets with or without shower facilities   Shelters,http://www.nparks.gov.sg/cms/index.php?option=com_visitorsguide&task=parks&id=42&Itemid=73,Woodlands Centre Road adjacent to Bukit Timah Expressway
Woodlands Waterfront Park,103.7799362,1.452813755,Woodlands Waterfront Park is a park located at Admiralty Road West in Singapore and overlooks the sea from the north. The 11 Hectares park houses a large playground with a wide range of equipment and a 1.5-kilometre-long waterfront promenade.,Multi generational   Playground   Picnic Lawns   Scenic Trails   Carpark   Toilets   Event lawn   Shelters   Look out points   Fitness corner or stations and fitness equipment or exercise station   Cycling track,http://www.nparks.gov.sg/cms/index.php?option=com_visitorsguide&task=parks&id=90&Itemid=73,Admiralty Road West
Yishun Park,103.8426399,1.424449978,"Developed on an old rubber estate, Yishun Park is home to an array of tropical fruit trees and natural vegetation. With facilities such as children playgrounds, fitness corners, an amphitheatre and multi-purpose courts, there’s something for everyone. The playgrounds provide children with hours of fun while the multi-purpose courts are great venues for family gatherings and activities.",Toilets   Multi purpose court  or corner   Jogging path or running track   Fitness corner or stations and fitness equipment or exercise station   Cycling track   Children's play equipment   Amphitheatre,http://www.nparks.gov.sg/cms/index.php?option=com_visitorsguide&task=parks&id=43&Itemid=73,"Bounded by Yishun Ave 4, Yishun Central, Yishun Ave 11 and Yishun Ring Road"
Youth Olympic Park,103.8604245,1.28905641,Youth Olympic Park is Singapore's first art park and was developed to foster a greater sense of community ownership and connection with Marina Bay.,<Null>,http://www.nparks.gov.sg/cms/index.php?option=com_visitorsguide&task=parks&id=88&Itemid=73,Raffles Avenue. Junction of Raffles Avenue and Bayfront Bridge
Zhenghua Park,103.7782886,1.36796167,"Zhenghua Nature Park is located in Bukit Panjang. Skirting the Central Catchment Nature Reserve, the nature park serves as a green buffer for the reserve.",Cycling track   Fitness corner or stations and fitness equipment or exercise station   Jogging path or running track   Playground   Shelters,http://www.nparks.gov.sg/cms/index.php?option=com_visitorsguide&task=parks&id=44&Itemid=73,"Bounded by Bt Timah Expressway (BKE), BKE Slip Road to Kranji Expressway (KJE) & Dairy Farm Road"